{
  "$schema": "../../../../../design/schemas/run.schema.json",
  "id": "mvp-11-harness-corrected",
  "experimentId": "experiment.account-management",
  "condition": "harness-corrected",
  "status": "completed",
  "createdAt": "2026-09-01T16:12:25.967Z",
  "input": {
    "briefSha256": "5cb085ea0f29284b5cfa3b26826e1ad0c53840db8a24bc61f1d272ffa10f08ee",
    "starterSha256": "e3ac89bf3f4e3e794495e3de3a1988303a490322752a3911e208ef41f8df2e30",
    "promptSha256": "88cc0a2e27fcc2e46e90109a9d0bcbc1c2ef66c000a9185831c93597c718fa7f",
    "designContractSha256": "3b155abe500c4a8f20056d18ba6c1f1ea304080c44c4aa83c43aa702be84c840"
  },
  "environment": {
    "runner": "codex",
    "model": "gpt-5.4",
    "cliVersion": "codex-cli 0.151.0"
  },
  "artifacts": [
    "events.jsonl",
    "agent-stderr.log",
    "changes.diff",
    "source",
    "typecheck.log",
    "test.log",
    "build.log",
    "design",
    "refinement-events.jsonl",
    "refinement-stderr.log",
    "measurements.json",
    "design-evaluation.json"
  ],
  "checks": [
    {
      "name": "typecheck",
      "status": "passed",
      "exitCode": 0
    },
    {
      "name": "test",
      "status": "passed",
      "exitCode": 0
    },
    {
      "name": "build",
      "status": "passed",
      "exitCode": 0
    },
    {
      "name": "design-rules",
      "status": "passed",
      "exitCode": 0
    }
  ]
}
